Sheet: Task matrix
A1: Task Statement | B1: Start Date | C1: End Date | D1: Jake Sebald | E1: Anne Meyer | F1: Zach Allison | G1: Joe Leanza | H1: Milestones
A2: Communicate progress with Advisor and Zoo Keeper | B2: 2019-10-01 | C2: 2020-02-04 | D2: 3 | E2: 3 | F2: 3 | G2: 3 | J2: 0.1 | K2: 0.7 | L2: 0.1 | M2: 0.1
A3: Research microcontroller options | B3: 2019-10-01 | C3: 2019-10-15 | D3: 0 | E3: 0 | F3: 4 | G3: 4 | L3: 0.49 | M3: 0.51
A4: Determine and maintain budget | B4: 2019-10-01 | C4: 2020-02-04 | D4: 1 | E4: 1 | F4: 3 | G4: 1 | J4: 0.1 | K4: 0.1 | L4: 0.7 | M4: 0.1
A5: Research Kea birds (what are they capable of?) | B5: 2019-10-01 | C5: 2019-10-15 | D5: 4 | E5: 2 | F5: 0 | G5: 0 | J5: 0.7 | K5: 0.3
A6: Investigate bird safe options | B6: 2019-10-01 | C6: 2019-10-15 | D6: 2 | E6: 4 | F6: 0 | G6: 0 | J6: 0.3 | K6: 0.7
A7: Design wired protype | B7: 2019-10-22 | C7: 2019-11-05 | D7: 0 | E7: 0 | F7: 12 | G7: 10 | H7: Our first milestone is to develop our very first prototype. Once this phase is complete, we will have a deeper understanding on where our project is heading. | L7: 0.6 | M7: 0.4
A8: Determine a reward system for Kea | B8: 2019-10-22 | C8: 2019-11-05 | D8: 12 | E8: 10 | F8: 0 | G8: 0 | J8: 0.6 | K8: 0.4
A9: Implement wired protype | B9: 2019-11-05 | C9: 2019-11-19 | D9: 0 | E9: 0 | F9: 8 | G9: 10 | H9: During this milestone, we will be creating our first prototype. We will refine what our protype will do and how it will function. | L9: 0.4 | M9: 0.6
A10: Program prototype game logic (Simon Says) | B10: 2019-11-05 | C10: 2019-11-19 | D10: 12 | E10: 10 | F10: 0 | G10: 0 | J10: 0.6 | K10: 0.4
A11: Program circuit to be used with the game | B11: 2019-11-05 | C11: 2019-11-19 | D11: 2 | E11: 2 | F11: 2 | G11: 5 | J11: 0.29 | L11: 0.2 | M11: 0.51
A12: Design wireless prototype | B12: 2019-11-05 | C12: 2019-11-26 | D12: 4 | E12: 4 | F12: 6 | G12: 4 | H12: In this phase, we will treat our wired prototype as a rough draft. In an effort to look out for the safety of the birds, we will attempt to design a wireless prototype . | J12: 0.1 | K12: 0.1 | L12: 0.6 | M12: 0.2
A13: Test wired protype with Kea | B13: 2019-11-19 | C13: 2019-11-26 | D13: 3 | E13: 3 | F13: 3 | G13: 3 | J13: 0.2 | K13: 0.51 | L13: 0.09 | M13: 0.2
A14: Train Kea to participate in game | B14: 2019-11-19 | C14: 2019-11-26 | D14: 4 | E14: 8 | F14: 4 | G14: 4 | H14: Training the Kea to interact with the game is a very important milestone. This is where we will be able to see what the birds are capable of doing and allow the zookeepers to begin to learn more about the Kea.
A15: Finalize circuit design | B15: 2019-11-26 | C15: 2019-12-10 | F15: 3 | G15: 3
A16: Total Hours Fall 2019 | D16: of:=SUM([.D2:.D15]) -> 47 | E16: of:=SUM([.E2:.E15]) -> 47 | F16: of:=SUM([.F2:.F15]) -> 48 | G16: of:=SUM([.G2:.G15]) -> 47
A17: Finalize game design | B17: 2019-11-26 | C17: 2019-12-10 | D17: 0.65 | G17: 0.35
A18: Document how to reprogram and install game | B18: 2019-11-26 | C18: 2020-02-04 | D18: 0.1 | E18: 0.7 | F18: 0.1 | G18: 0.1
A19: Implement wireless prototype | B19: 2020-01-13 | C19: 2020-01-28 | D19: 0.31 | F19: 0.69 | H19: Implementation our wireless prototype will allow for better safety for the birds and make it easier for the zookeepers to assemble and install the game every season.
A20: Refine the game logic to be reprogrammable | B20: 2020-01-13 | C20: 2020-01-28 | D20: 0.75 | E20: 0.25
A21: Install game at the Zoo | B21: 2020-01-28 | C21: 2020-02-04 | D21: 0.15 | E21: 0.19 | F21: 0.51 | G21: 0.15 | H21: Finally, this milestone marks the completetion of our project. Once the game is properly installed then the zookeepers are able to begin to implement the game with the Kea and the guests.
A22: Test wireless prototype | B22: 2020-01-28 | C22: 2020-02-04 | D22: 0.09 | E22: 0.51 | F22: 0.2 | G22: 0.2
A23: Connect a reward system with the game | B23: 2020-01-28 | C23: 2020-02-04 | E23: 0.1 | G23: 0.9
A24: Total Hours Spring 2020 (Estimate percent for now) | D24: of:=SUM([.D17:.D23]) -> 2.05 | E24: of:=SUM([.E17:.E23]) -> 1.75 | F24: of:=SUM([.F17:.F23]) -> 1.5 | G24: of:=SUM([.G17:.G23]) -> 1.7